{
  "version": "3",
  "code": "bomet-blue",
  "name": "Bomet Blue",
  "colors": {
    "grey": { "bg": "#E6E6E6", "light": "#FAFAFA", "lighter": "#F2F2F2", "disabled": "#C5C5C5" },
    "link": { "hover": "#1B85D2", "normal": "#1565A8" },
    "text": { "muted": "#787878", "heading": "#1565A8", "primary": "#1D2433", "secondary": "#5F5C62" },
    "primary": { "dark": "#1565A8", "main": "#1B85D2", "light": "#E3F0FA", "accent": "#E5202A", "selected-bg": "#E3F0FA" },
    "digitv2": {
      "chart-1": "#1B85D2",
      "chart-2": "#E5202A",
      "chart-3": "#128F21",
      "chart-4": "#FEC931",
      "chart-5": "#F58831",
      "alert-info": "#1B85D2",
      "primary-bg": "#E3F0FA",
      "header-sidenav": "#1B85D2",
      "text-color-disabled": "#B1B4B6",
      "alert-error-bg": "#FDEEEF",
      "alert-success-bg": "#E7F4E9"
    },
    "secondary": "#1D2433",
    "border": "#D6D5D4",
    "input-border": "#E1E6EF",
    "error": "#E02D3A",
    "error-dark": "#A8222C",
    "success": "#128F21",
    "info": "#1B85D2",
    "info-dark": "#1565A8",
    "warning": "#9E5F00",
    "warning-dark": "#9E5F00",
    "brand": "#1B85D2",
    "brand-on": "#1565A8",
    "surface-header": "#1565A8",
    "surface-page": "#FAFAFA",
    "selected-bg": "#E3F0FA",
    "primary-1": "#1565A8",
    "primary-2": "#1B85D2",
    "primary-1-bg": "#E3F0FA",
    "primary-2-bg": "#E4F0FA",
    "page-bg": "#FFFFFF",
    "page-secondary-bg": "#FAFAFA",
    "text-heading": "#1565A8",
    "text-primary": "#1D2433",
    "text-secondary": "#5F5C62",
    "text-disabled": "#C5C5C5",
    "button-primary-bg-default": "#1565A8",
    "button-primary-bg-hover": "#1875B9",
    "button-primary-bg-pressed": "#1568A4",
    "button-primary-text": "#FFFFFF",
    "button-primary-border": "#1565A8",
    "button-primary-disabled-bg": "#E5E7EB",
    "button-primary-disabled-text": "#9CA3AF",
    "button-secondary-bg-default": "#FFFFFF",
    "button-secondary-bg-hover": "#F1F8FC",
    "button-secondary-bg-pressed": "#E8F3FB",
    "button-secondary-text": "#1565A8",
    "button-secondary-border": "#1565A8",
    "button-tertiary-text": "#1565A8",
    "input-bg": "#FFFFFF",
    "input-border-default": "#D1D5DB",
    "input-border-focus": "#1B85D2",
    "input-border-error": "#E02D3A",
    "input-placeholder": "#9CA3AF",
    "input-text": "#1D2433",
    "input-label": "#4B5563",
    "input-helper": "#6B7280",
    "header-bg": "#1565A8",
    "header-text": "#FFFFFF",
    "header-icon": "#FFFFFF",
    "sidebar-bg": "#1565A8",
    "sidebar-text-active": "#FFFFFF",
    "sidebar-text-default": "#D1D5DB",
    "sidebar-hover-text": "#1565A8",
    "sidebar-hover-bg": "#E4F0FA",
    "sidebar-icon-active": "#FFFFFF",
    "sidebar-selected-bg": "#093B50",
    "sidebar-selected-text": "#FFFFFF",
    "card-border": "#D6D5D4",
    "card-divider": "#D6D5D4",
    "card-success": "#128F21",
    "card-error": "#E02D3A",
    "status-success-text": "#128F21",
    "status-success-bg": "#E7F4E9",
    "status-success-border": "#128F21",
    "status-error-text": "#E02D3A",
    "status-error-bg": "#FDEEEF",
    "status-error-border": "#E02D3A",
    "status-warning-text": "#9E5F00",
    "status-warning-bg": "#F5EFE6",
    "status-warning-border": "#9E5F00",
    "status-info-text": "#1B85D2",
    "status-info-bg": "#E3F0FA",
    "status-info-border": "#1B85D2",
    "table-header-bg": "#F3F4F6",
    "table-header-text": "#1565A8",
    "table-row-bg": "#FFFFFF",
    "table-alt-row": "#FAFAFA",
    "table-row-text": "#1D2433",
    "table-border": "#D6D5D4",
    "table-hover": "#E3F0FA",
    "table-selected": "#E3F0FA",
    "table-hover-text": "#1D2433",
    "table-selected-text": "#1565A8",
    "loader": "#1565A8",
    "progress": "#1565A8",
    "tooltip-bg": "#1565A8",
    "tooltip-text": "#FFFFFF",
    "chart-1": "#1B85D2",
    "chart-2": "#E5202A",
    "chart-3": "#128F21",
    "chart-4": "#FEC931",
    "chart-5": "#F58831"
  }
}
