{
  "version": "3",
  "code": "maputo-green",
  "name": "Maputo Green",
  "colors": {
    "grey": { "bg": "#E6E6E6", "light": "#FAFAFA", "lighter": "#F2F2F2", "disabled": "#C5C5C5" },
    "link": { "hover": "#035C2F", "normal": "#046A38" },
    "text": { "muted": "#787878", "heading": "#046A38", "primary": "#1D2433", "secondary": "#5F5C62" },
    "primary": { "dark": "#035C2F", "main": "#FFCE00", "light": "#EBF3EF", "accent": "#CE1126", "selected-bg": "#EBF3EF" },
    "digitv2": {
      "chart-1": "#046A38",
      "chart-2": "#FFCE00",
      "chart-3": "#CE1126",
      "chart-4": "#234E70",
      "chart-5": "#6B7280",
      "alert-info": "#234E70",
      "primary-bg": "#FFF9E0",
      "header-sidenav": "#046A38",
      "text-color-disabled": "#B1B4B6",
      "alert-error-bg": "#FBECEE",
      "alert-success-bg": "#E7F4E9"
    },
    "secondary": "#1D2433",
    "border": "#D6D5D4",
    "input-border": "#D1D5DB",
    "error": "#CE1126",
    "error-dark": "#9B0D1D",
    "success": "#046A38",
    "info": "#234E70",
    "info-dark": "#1E425F",
    "warning": "#9E5F00",
    "warning-dark": "#9E5F00",
    "brand": "#FFCE00",
    "brand-on": "#046A38",
    "surface-header": "#046A38",
    "surface-page": "#FAFAFA",
    "selected-bg": "#FFF9E0",
    "primary-1": "#046A38",
    "primary-2": "#FFCE00",
    "primary-1-bg": "#EBF3EF",
    "primary-2-bg": "#FFF9E0",
    "page-bg": "#FFFFFF",
    "page-secondary-bg": "#FAFAFA",
    "text-heading": "#046A38",
    "text-primary": "#1D2433",
    "text-secondary": "#5F5C62",
    "text-disabled": "#C5C5C5",
    "button-primary-bg-default": "#FFCE00",
    "button-primary-bg-hover": "#E0B500",
    "button-primary-bg-pressed": "#C7A100",
    "button-primary-text": "#046A38",
    "button-primary-border": "#FFCE00",
    "button-primary-disabled-bg": "#E5E7EB",
    "button-primary-disabled-text": "#9CA3AF",
    "button-secondary-bg-default": "#FFFFFF",
    "button-secondary-bg-hover": "#F0F6F3",
    "button-secondary-bg-pressed": "#E6F0EB",
    "button-secondary-text": "#046A38",
    "button-secondary-border": "#046A38",
    "button-tertiary-text": "#046A38",
    "input-bg": "#FFFFFF",
    "input-border-default": "#D1D5DB",
    "input-border-focus": "#046A38",
    "input-border-error": "#CE1126",
    "input-placeholder": "#9CA3AF",
    "input-text": "#1D2433",
    "input-label": "#4B5563",
    "input-helper": "#6B7280",
    "header-bg": "#046A38",
    "header-text": "#FFFFFF",
    "header-icon": "#FFFFFF",
    "sidebar-bg": "#046A38",
    "sidebar-text-active": "#FFFFFF",
    "sidebar-text-default": "#D1D5DB",
    "sidebar-hover-text": "#046A38",
    "sidebar-hover-bg": "#D9E9E1",
    "sidebar-icon-active": "#FFFFFF",
    "sidebar-selected-bg": "#FFCE00",
    "sidebar-selected-text": "#046A38",
    "card-border": "#D6D5D4",
    "card-divider": "#D6D5D4",
    "card-success": "#046A38",
    "card-error": "#CE1126",
    "status-success-text": "#046A38",
    "status-success-bg": "#E7F4E9",
    "status-success-border": "#046A38",
    "status-error-text": "#CE1126",
    "status-error-bg": "#FBECEE",
    "status-error-border": "#CE1126",
    "status-warning-text": "#9E5F00",
    "status-warning-bg": "#F5EFE6",
    "status-warning-border": "#9E5F00",
    "status-info-text": "#234E70",
    "status-info-bg": "#EDF1F4",
    "status-info-border": "#234E70",
    "table-header-bg": "#F5F9F7",
    "table-header-text": "#046A38",
    "table-row-bg": "#FFFFFF",
    "table-alt-row": "#FAFAFA",
    "table-row-text": "#1D2433",
    "table-border": "#D6D5D4",
    "table-hover": "#EBF3EF",
    "table-selected": "#EBF3EF",
    "table-hover-text": "#1D2433",
    "table-selected-text": "#046A38",
    "loader": "#046A38",
    "progress": "#046A38",
    "tooltip-bg": "#046A38",
    "tooltip-text": "#FFFFFF",
    "chart-1": "#046A38",
    "chart-2": "#FFCE00",
    "chart-3": "#CE1126",
    "chart-4": "#234E70",
    "chart-5": "#6B7280"
  }
}
