{
  "version": "3",
  "code": "cms-blue",
  "name": "CMS Blue",
  "colors": {
    "grey": {
      "bg": "#E6E6E6",
      "mid": "#EEEEEE",
      "dark": "#787878",
      "light": "#FAFAFA",
      "lighter": "#F2F2F2",
      "disabled": "#C5C5C5"
    },
    "link": {
      "hover": "#1D4FD8",
      "normal": "#2563EB"
    },
    "text": {
      "muted": "#6B7280",
      "heading": "#1D2433",
      "primary": "#1D2433",
      "secondary": "#4B5563"
    },
    "error": "#E02D3A",
    "border": "#D6D5D4",
    "loader": "#2563EB",
    "chart-1": "#2563EB",
    "chart-2": "#E5202A",
    "chart-3": "#128F21",
    "chart-4": "#FEC931",
    "chart-5": "#F58831",
    "digitv2": {
      "chart-1": "#2563EB",
      "chart-2": "#E5202A",
      "chart-3": "#128F21",
      "chart-4": "#FEC931",
      "chart-5": "#F58831",
      "alert-info": "#1D4ED8",
      "primary-bg": "#EFF6FF",
      "alert-info-bg": "#EFF6FF",
      "alert-error-bg": "#FEF1F2",
      "header-sidenav": "#0B1F3A",
      "alert-success-bg": "#E0F2E1",
      "text-color-disabled": "#B1B4B6"
    },
    "page-bg": "#FFFFFF",
    "primary": {
      "dark": "#0B1F3A",
      "main": "#2563EB",
      "light": "#EFF6FF",
      "accent": "#0B1F3A",
      "selected-bg": "#EFF6FF"
    },
    "success": "#128F21",
    "input-bg": "#FFFFFF",
    "progress": "#2563EB",
    "header-bg": "#0B1F3A",
    "info-dark": "#1D4ED8",
    "primary-1": "#0B1F3A",
    "primary-2": "#2563EB",
    "secondary": "#0B1F3A",
    "card-error": "#C62828",
    "error-dark": "#8B0000",
    "input-text": "#1D2433",
    "sidebar-bg": "#0B1F3A",
    "text-muted": "#6B7280",
    "tooltip-bg": "#0B1F3A",
    "card-border": "#E5E7EB",
    "header-icon": "#FFFFFF",
    "header-text": "#FFFFFF",
    "input-label": "#1D2433",
    "table-hover": "#EFF6FF",
    "card-divider": "#E5E7EB",
    "card-success": "#2E7D32",
    "input-border": "#E1E6EF",
    "input-helper": "#6B7280",
    "primary-1-bg": "#EFF6FF",
    "primary-2-bg": "#EFF6FF",
    "table-border": "#E5E7EB",
    "table-row-bg": "#FFFFFF",
    "text-heading": "#1D2433",
    "text-primary": "#1D2433",
    "tooltip-text": "#FFFFFF",
    "warning-dark": "#9E5F00",
    "table-alt-row": "#FAFAFA",
    "text-disabled": "#C5C5C5",
    "status-info-bg": "#EFF6FF",
    "table-row-text": "#1D2433",
    "table-selected": "#EFF6FF",
    "text-secondary": "#4B5563",
    "status-error-bg": "#FEF1F2",
    "table-header-bg": "#F3F4F6",
    "sidebar-hover-bg": "#16305A",
    "status-info-text": "#1D4ED8",
    "table-hover-text": "#1D2433",
    "input-placeholder": "#9CA3AF",
    "page-secondary-bg": "#FAFAFA",
    "status-error-text": "#E02D3A",
    "status-success-bg": "#E0F2E1",
    "table-header-text": "#1D2433",
    "input-border-error": "#C62828",
    "input-border-focus": "#2563EB",
    "sidebar-hover-text": "#FFFFFF",
    "button-primary-text": "#FFFFFF",
    "sidebar-icon-active": "#FFFFFF",
    "sidebar-selected-bg": "#2563EB",
    "sidebar-text-active": "#FFFFFF",
    "status-success-text": "#128F21",
    "status-warning-text": "#9E5F00",
    "table-selected-text": "#1D2433",
    "button-tertiary-text": "#2563EB",
    "input-border-default": "#E1E6EF",
    "sidebar-text-default": "#C7D2E3",
    "button-primary-border": "#2563EB",
    "button-secondary-text": "#2563EB",
    "sidebar-selected-text": "#FFFFFF",
    "button-primary-bg-hover": "#1D4FD8",
    "button-secondary-border": "#2563EB",
    "button-primary-bg-default": "#2563EB",
    "button-primary-bg-pressed": "#1E40AF",
    "button-secondary-bg-hover": "#F9FAFB",
    "button-primary-disabled-bg": "#E5E7EB",
    "button-secondary-bg-default": "#FFFFFF",
    "button-secondary-bg-pressed": "#F3F4F6",
    "button-primary-disabled-text": "#9CA3AF"
  }
}
